{
  "$schema": "../schemas/open-logic-language-editions.schema.json",
  "schema": "mathematics-commons-open-logic-language-editions/v1",
  "updated_at_utc": "2026-08-20T17:46:10Z",
  "edition_label": "independently_maintained_ai_produced_no_upstream_endorsement",
  "work": {
    "id": "open-logic-project",
    "title": "Open Logic Project",
    "upstream_repository": "https://github.com/OpenLogicProject/OpenLogic"
  },
  "editions": [
    {
      "id": "open-logic-text-pt-br-2026-08-20-r4",
      "language_tag": "pt-BR",
      "language_label": "Português brasileiro",
      "edition_title": "The Open Logic Text — edição em português brasileiro",
      "version": "2026-08-20-r4",
      "release_state": "current",
      "production_disclosure": "independently_maintained_ai_produced_no_upstream_endorsement",
      "repository_url": "https://github.com/KokunoYumeto/OpenLogic-pt-BR",
      "release_url": "https://github.com/KokunoYumeto/OpenLogic-pt-BR/releases/tag/v2026-08-20-r4",
      "reader_url": "https://github.com/KokunoYumeto/OpenLogic-pt-BR/releases/download/v2026-08-20-r4/00_OLP_pt-BR_CURRENT_LINKED_READER.pdf",
      "source_commit": "9620cc73f9c8e0ad003c514a5d3748f29611c4c0",
      "source_tree": "f67757bb9305b173634082ab4cefd5601a707a34",
      "source_unit_coverage": {
        "source_units": 722,
        "translated_units": 722,
        "label": "722/722"
      },
      "rights_state": "cc_by_4_0_with_attribution_and_provenance",
      "license": "CC BY 4.0",
      "license_url": "https://creativecommons.org/licenses/by/4.0/",
      "zenodo": {
        "concept_doi": "10.5281/zenodo.21973104",
        "concept_doi_url": "https://doi.org/10.5281/zenodo.21973104",
        "version_doi": "10.5281/zenodo.22032986",
        "version_doi_url": "https://doi.org/10.5281/zenodo.22032986"
      }
    },
    {
      "id": "open-logic-text-es-2026-08-19-r3",
      "language_tag": "es",
      "language_label": "Español",
      "edition_title": "The Open Logic Text — edición en español",
      "version": "2026-08-19-r3",
      "release_state": "current",
      "production_disclosure": "independently_maintained_ai_produced_no_upstream_endorsement",
      "repository_url": "https://github.com/KokunoYumeto/OpenLogic-es",
      "release_url": "https://github.com/KokunoYumeto/OpenLogic-es/releases/tag/v2026-08-19-r3",
      "reader_url": "https://github.com/KokunoYumeto/OpenLogic-es/releases/download/v2026-08-19-r3/00_OLP_es_CURRENT_LINKED_READER.pdf",
      "source_commit": "9620cc73f9c8e0ad003c514a5d3748f29611c4c0",
      "source_tree": "f67757bb9305b173634082ab4cefd5601a707a34",
      "source_unit_coverage": {
        "source_units": 722,
        "translated_units": 722,
        "label": "722/722"
      },
      "rights_state": "cc_by_4_0_with_attribution_and_provenance",
      "license": "CC BY 4.0",
      "license_url": "https://creativecommons.org/licenses/by/4.0/",
      "zenodo": {
        "concept_doi": "10.5281/zenodo.21997720",
        "concept_doi_url": "https://doi.org/10.5281/zenodo.21997720",
        "version_doi": "10.5281/zenodo.22015980",
        "version_doi_url": "https://doi.org/10.5281/zenodo.22015980"
      }
    }
  ]
}
